name      ,type     ,strDefault ,array ,omitempty ,doc ,example             ,description
range     ,blkrange ,           ,      ,          ,  1 ,013142464-013145212 ,the block range (inclusive) covered by this chunk ,
bloomHash ,ipfshash ,           ,      ,          ,  2 ,QmXHjjY...HDqvWT    ,the IPFS hash of the bloom filter at that range
indexHash ,ipfshash ,           ,      ,          ,  3 ,QmTbYpR...qWLj44    ,the IPFS hash of the index chunk at that range
bloomSize ,int64    ,           ,      ,          ,  4 ,                    ,the size of the bloom filter in bytes
indexSize ,int64    ,           ,      ,          ,  5 ,                    ,the size of the index portion in bytes
