num,group,tags,api_route,tool,longName,hotKey,def_val,is_required,is_customizable,is_visible,is_visible_docs,generate,option_type,data_type,description

10200,apps,Accounts,export,acctExport,addrs,,,true,false,true,true,local,positional,list<addr>,one or more addresses (0x...) to export
10205,apps,Accounts,export,acctExport,topics,,,false,false,true,true,local,positional,list<topic>,filter by one or more log topics (only for --logs option)
10207,apps,Accounts,export,acctExport,fourbytes,,,false,false,true,true,header,positional,list<fourbyte>,filter by one or more fourbytes (only for transactions and trace options)
10210,apps,Accounts,export,acctExport,appearances,p,,false,false,true,true,header,switch,<boolean>,export a list of appearances
10220,apps,Accounts,export,acctExport,receipts,r,,false,false,true,true,header,switch,<boolean>,export receipts instead of transactional data
10230,apps,Accounts,export,acctExport,logs,l,,false,false,true,true,header,switch,<boolean>,export logs instead of transactional data
10240,apps,Accounts,export,acctExport,traces,t,,false,false,true,true,header,switch,<boolean>,export traces instead of transactional data
10282,apps,Accounts,export,acctExport,statements,A,,false,false,true,true,header,switch,<boolean>,export reconciliations instead of transactional data (requires --accounting option)
10215,apps,Accounts,export,acctExport,neighbors,n,,false,false,true,true,header,switch,<boolean>,export the neighbors of the given address
10280,apps,Accounts,export,acctExport,accounting,C,,false,false,true,true,header,switch,<boolean>,attach accounting records to the exported data (applies to transactions export only)
10310,apps,Accounts,export,acctExport,articulate,a,,false,false,true,true,header,switch,<boolean>,articulate transactions&#44; traces&#44; logs&#44; and outputs
10320,apps,Accounts,export,acctExport,cache,i,false,false,true,true,true,header,switch,<boolean>,write transactions to the cache (see notes)
10330,apps,Accounts,export,acctExport,cache_traces,R,false,false,true,true,true,header,switch,<boolean>,write traces to the cache (see notes)
10332,apps,Accounts,export,acctExport,factory,y,false,false,false,true,false,header,switch,<boolean>,scan for contract creations from the given address(es) and report address of those contracts
10334,apps,Accounts,export,acctExport,count,U,,false,false,true,true,header,switch,<boolean>,only available for --appearances mode&#44; if present&#44; return only the number of records
10336,apps,Accounts,export,acctExport,first_record,c,0,false,false,true,true,header,flag,<blknum>,the first record to process
10338,apps,Accounts,export,acctExport,max_records,e,250,false,false,true,true,header,flag,<blknum>,the maximum number of records to process before reporting
10340,apps,Accounts,export,acctExport,relevant,,,false,false,true,true,header,switch,<boolean>,for log and accounting export only&#44; export only logs relevant to one of the given export addresses
10342,apps,Accounts,export,acctExport,emitter,,,false,false,true,true,local,flag,list<addr>,for log export only&#44; export only logs if emitted by one of these address(es)
10344,apps,Accounts,export,acctExport,topic,,,false,false,true,true,local,flag,list<topic>,for log export only&#44; export only logs with this topic(s)
10346,apps,Accounts,export,acctExport,asset,,,false,false,true,true,local,flag,list<addr>,for the statements option only&#44; export only reconciliations for this asset
10085,apps,Accounts,export,acctExport,clean,,,false,false,true,true,header,switch,<boolean>,clean (i.e. remove duplicate appearances) from all existing monitors
10380,apps,Accounts,export,acctExport,freshen,f,,false,false,false,false,local,switch,<boolean>,freshen but do not print the exported data
10060,apps,Accounts,export,acctExport,staging,s,,false,false,true,true,header,switch,<boolean>,export transactions labeled staging (i.e. older than 28 blocks but not yet consolidated)
10080,apps,Accounts,export,acctExport,unripe,u,,false,false,true,true,header,switch,<boolean>,export transactions labeled upripe (i.e. less than 28 blocks old)
10092,apps,Accounts,export,acctExport,load,,,false,false,false,false,header,flag,<string>,a comma separated list of dynamic traversers to load
10093,apps,Accounts,export,acctExport,reversed,,,false,false,false,false,header,switch,<boolean>,produce results in reverse chronological order
10094,apps,Accounts,export,acctExport,by_date,b,,false,false,false,false,header,switch,<boolean>,produce results sorted by date (report by address otherwise)
10095,apps,Accounts,export,acctExport,summarize_by,z,,false,false,false,false,header,flag,enum[yearly|quarterly|monthly|weekly|daily|hourly|blockly|tx],for --accounting only&#44; summarize reconciliations by this time period
10097,apps,Accounts,export,acctExport,deep,D,,false,false,false,false,header,switch,<boolean>,for --neighbors option only&#44; dig deeply into detail (otherwise&#44; to and from only)
10340,apps,Accounts,export,acctExport,skip_ddos,d,true,false,true,false,false,config,toggle,<boolean>,toggle skipping over 2016 dDos transactions ([{DEF}] by default)
10350,apps,Accounts,export,acctExport,max_traces,m,250,false,true,false,false,config,flag,<uint64>,if --skip_ddos is on&#44; this many traces defines what a ddos transaction is
10440,apps,Accounts,export,acctExport,first_block,F,0,false,false,true,true,local,flag,<blknum>,first block to process (inclusive)
10450,apps,Accounts,export,acctExport,last_block,L,NOPOS,false,false,true,true,local,flag,<blknum>,last block to process (inclusive)
10460,apps,Accounts,export,acctExport,,,,false,false,true,true,--,description,,Export full detail of transactions for one or more addresses.
10470,apps,Accounts,export,acctExport,n1,,,false,false,false,false,--,note,,An `address` must start with '0x' and be forty-two characters long.
10470,apps,Accounts,export,acctExport,n2,,,false,false,false,false,--,note,,Articulating the export means turn the EVM's byte data into human-readable text (if possible).
10472,apps,Accounts,export,acctExport,n3,,,false,false,false,false,--,note,,For the --logs option&#44; you may optionally specify one or more --emmitter&#44; one or more --topics&#44; or both.
10474,apps,Accounts,export,acctExport,n4,,,false,false,false,false,--,note,,The --logs option is significantly faster if you provide an --emitter or a --topic.
10476,apps,Accounts,export,acctExport,n5,,,false,false,false,false,--,note,,Neighbors include every address that appears in any transaction in which the export address also appears.

11200,apps,Accounts,monitors,acctExport,addrs,,,true,false,true,true,local,positional,list<addr>,one or more addresses (0x...) to process
11210,apps,Accounts,monitors,acctExport,appearances,p,,false,false,true,true,header,switch,<boolean>,export a list of appearances
12015,apps,Accounts,monitors,acctExport,count,U,,false,false,true,true,header,switch,<boolean>,present only the number of records
11085,apps,Accounts,monitors,acctExport,clean,,,false,false,true,true,header,switch,<boolean>,clean (i.e. remove duplicate appearances) from monitors
11087,apps,Accounts,monitors,acctExport,deleteMe,,,false,false,true,true,local,switch,<boolean>,delete a monitor&#44; but do not remove it
11093,apps,Accounts,monitors,acctExport,undelete,,,false,false,true,true,local,switch,<boolean>,undelete a previously deleted monitor
11091,apps,Accounts,monitors,acctExport,remove,,,false,false,true,true,local,switch,<boolean>,remove a previously deleted monitor
11440,apps,Accounts,monitors,acctExport,first_block,F,0,false,false,false,false,local,flag,<blknum>,first block to process (inclusive)
11450,apps,Accounts,monitors,acctExport,last_block,L,NOPOS,false,false,false,false,local,flag,<blknum>,last block to process (inclusive)
11095,apps,Accounts,monitors,acctExport,,,,false,false,true,true,--,description,,Add&#44; remove&#44; clean&#44; and list address monitors.
11097,apps,Accounts,monitors,acctExport,n1,,,false,false,false,false,--,note,,An `address` must start with '0x' and be forty-two characters long.
11099,apps,Accounts,monitors,acctExport,n2,,,false,false,false,false,--,note,,If no address is presented to the --clean command&#44; all monitors will be cleaned.

12005,apps,Accounts,list,acctExport,addrs,,,true,false,true,true,local,positional,list<addr>,one or more addresses (0x...) to list
12015,apps,Accounts,list,acctExport,count,U,,false,false,true,true,header,switch,<boolean>,present only the number of records
11210,apps,Accounts,list,acctExport,appearances,p,,false,false,false,true,header,switch,<boolean>,export a list of appearances
11440,apps,Accounts,list,acctExport,first_block,F,0,false,false,false,false,local,flag,<blknum>,first block to process (inclusive)
11450,apps,Accounts,list,acctExport,last_block,L,NOPOS,false,false,false,false,local,flag,<blknum>,last block to process (inclusive)
12025,apps,Accounts,list,acctExport,,,,false,false,true,true,--,description,,List every appearance of an address anywhere on the chain.

12260,tools,Accounts,names,ethNames,terms,,,true,false,true,true,header,positional,list<string>,a space separated list of one or more search terms
12280,tools,Accounts,names,ethNames,expand,e,,false,false,true,true,local,switch,<boolean>,expand search to include all fields (search name&#44; address&#44; and symbol otherwise)
12300,tools,Accounts,names,ethNames,match_case,m,,false,false,true,true,header,switch,<boolean>,do case-sensitive search
12315,tools,Accounts,names,ethNames,all,l,,false,false,true,true,local,switch,<boolean>,include all accounts in the search
12340,tools,Accounts,names,ethNames,custom,c,,false,false,true,true,local,switch,<boolean>,include your custom named accounts
12360,tools,Accounts,names,ethNames,prefund,p,,false,false,true,true,header,switch,<boolean>,include prefund accounts
12380,tools,Accounts,names,ethNames,named,n,,false,false,true,true,local,switch,<boolean>,include well know token and airdrop addresses in the search
12420,tools,Accounts,names,ethNames,addr,a,,false,false,true,true,local,switch,<boolean>,display only addresses in the results (useful for scripting)
12430,tools,Accounts,names,ethNames,collections,s,,false,false,true,true,header,switch,<boolean>,display collections data
12445,tools,Accounts,names,ethNames,tags,g,,false,false,true,true,header,switch,<boolean>,export the list of tags and subtags only
12450,tools,Accounts,names,ethNames,to_custom,u,,false,false,false,false,header,switch,<boolean>,for editCmd only&#44; is the edited name a custom name or not
12455,tools,Accounts,names,ethNames,clean,C,,false,false,false,false,local,switch,<boolean>,clean the data (addrs to lower case&#44; sort by addr)
12456,tools,Accounts,names,ethNames,autoname,A,,false,false,false,false,local,flag,<string>,an address assumed to be a token&#44; added automatically to names database if true
12460,tools,Accounts,names,ethNames,create,,,false,false,false,true,local,switch,<boolean>,create a new name record
12462,tools,Accounts,names,ethNames,deleteMe,,,false,false,false,true,local,switch,<boolean>,delete a name&#44; but do not remove it
12464,tools,Accounts,names,ethNames,update,,,false,false,false,true,local,switch,<boolean>,edit an existing name
12466,tools,Accounts,names,ethNames,remove,,,false,false,false,true,local,switch,<boolean>,remove a previously deleted name
12468,tools,Accounts,names,ethNames,undelete,,,false,false,false,true,local,switch,<boolean>,undelete a previously deleted name
12470,tools,Accounts,names,ethNames,,,,false,false,true,true,--,description,,Query addresses or names of well known accounts.
12472,tools,Accounts,names,ethNames,n1,,,false,false,false,false,--,note,,The tool will accept up to three terms&#44; each of which must match against any field in the database.
12478,tools,Accounts,names,ethNames,n2,,,false,false,false,false,--,note,,The `--match_case` option enables case sensitive matching.

13660,tools,Accounts,abis,grabABI,addrs,,,true,false,true,true,header,positional,list<addr>,a list of one or more smart contracts whose ABIs to display
13850,tools,Accounts,abis,grabABI,known,k,,false,false,true,true,local,switch,<boolean>,load common 'known' ABIs from cache
13860,tools,Accounts,abis,grabABI,sol,s,,false,false,true,true,local,switch,<boolean>,extract the abi definition from the provided .sol file(s)
13865,tools,Accounts,abis,grabABI,find,f,,false,false,true,true,local,flag,list<string>,search for function or event declarations given a four- or 32-byte code(s)
13867,tools,Accounts,abis,grabABI,classes,c,,false,false,false,false,local,switch,<boolean>,generate classDefinitions folder and class definitions
13880,tools,Accounts,abis,grabABI,,,,false,false,true,true,--,description,,Fetches the ABI for a smart contract.
13885,tools,Accounts,abis,grabABI,n1,,,false,false,false,false,--,note,,For the --sol option&#44; place the solidity files in the current working folder.
13885,tools,Accounts,abis,grabABI,n2,,,false,false,false,false,--,note,,Search for either four byte signatures or event signatures with the --find option.

12500,tools,ChainData,blocks,getBlocks,blocks,,,true,false,true,true,local,positional,list<blknum>,a space-separated list of one or more block identifiers
12510,tools,ChainData,blocks,getBlocks,hashes,e,,false,false,true,true,header,switch,<boolean>,display only transaction hashes&#44; default is to display full transaction detail
12520,tools,ChainData,blocks,getBlocks,uncles,U,,false,false,true,true,header,switch,<boolean>,display uncle blocks (if any) instead of the requested block
12530,tools,ChainData,blocks,getBlocks,trace,t,,false,false,true,true,header,switch,<boolean>,export the traces from the block as opposed to the block data
12540,tools,ChainData,blocks,getBlocks,apps,s,,false,false,true,true,local,switch,<boolean>,display a list of uniq address appearances in the block
12560,tools,ChainData,blocks,getBlocks,uniq,u,,false,false,true,true,local,switch,<boolean>,display a list of uniq address appearances per transaction
12570,tools,ChainData,blocks,getBlocks,logs,g,,false,false,false,true,header,switch,<boolean>,display only the logs found in the block(s)
12972,tools,ChainData,blocks,getBlocks,emitter,m,,false,false,false,true,local,flag,list<addr>,for the --logs option only&#44; filter logs to show only those logs emitted by the given address(es)
12974,tools,ChainData,blocks,getBlocks,topic,p,,false,false,false,true,local,flag,list<topic>,for the --logs option only&#44; filter logs to show only those with this topic(s)
12975,tools,ChainData,blocks,getBlocks,articulate,a,,false,false,false,false,header,switch,<boolean>,for the --logs option only&#44; articulate the retrieved data if ABIs can be found
12976,tools,ChainData,blocks,getBlocks,big_range,r,500,false,false,false,false,header,flag,<uint64>,for the --logs option only&#44; allow for block ranges larger than 500
12578,tools,ChainData,blocks,getBlocks,count,c,,false,false,true,true,header,switch,<boolean>,display the number of the lists of appearances for --addrs or --uniq
12580,tools,ChainData,blocks,getBlocks,cache,o,,false,false,true,true,header,switch,<boolean>,force a write of the block to the cache
12582,tools,ChainData,blocks,getBlocks,list,l,0,false,false,false,false,local,flag,<blknum>,summary list of blocks running backwards from latest block minus num
12584,tools,ChainData,blocks,getBlocks,list_count,C,0,false,false,false,false,header,flag,<blknum>,the number of blocks to report for --list option
12590,tools,ChainData,blocks,getBlocks,,,,false,false,true,true,--,description,,Retrieve one or more blocks from the chain or local cache.
12600,tools,ChainData,blocks,getBlocks,n1,,,false,false,false,false,--,note,,`blocks` is a space-separated list of values&#44; a start-end range&#44; a `special`&#44; or any combination.
12610,tools,ChainData,blocks,getBlocks,n2,,,false,false,false,false,--,note,,`blocks` may be specified as either numbers or hashes.
12620,tools,ChainData,blocks,getBlocks,n3,,,false,false,false,false,--,note,,`special` blocks are detailed under `chifra when --list`.
12622,tools,ChainData,blocks,getBlocks,n4,,,false,false,false,false,--,note,,With the --logs option&#44; optionally specify one or more --emmitter&#44; one or more --topics&#44; either or both.
12624,tools,ChainData,blocks,getBlocks,n5,,,false,false,false,false,--,note,,The --logs option is significantly faster if you provide an --emitter and/or a --topic.
12625,tools,ChainData,blocks,getBlocks,n6,,,false,false,false,false,--,note,,Multiple topics match on topic0&#44; topic1&#44; and so on&#44; not on different topic0's.
12627,tools,ChainData,blocks,getBlocks,n7,,,false,false,false,false,--,note,,Large block ranges may crash the node&#44; use --big_range to specify a larger range.
12626,tools,ChainData,blocks,getBlocks,ERR_NOCACHEUNCLE,,,false,false,false,false,--,error,,The --cache option is not available for uncle blocks.
12628,tools,ChainData,blocks,getBlocks,ERR_NOCACHEADDRESS,,,false,false,false,false,--,error,,The --cache option is not available when using one of the address options.
12630,tools,ChainData,blocks,getBlocks,ERR_TRACINGREQUIRED,,,false,false,false,false,--,error,,A tracing node is required for the --trace options to work properly.
12632,tools,ChainData,blocks,getBlocks,ERR_NOTRACEADDRESS,,,false,false,false,false,--,error,,The --trace option is not available when using one of the address options.
12634,tools,ChainData,blocks,getBlocks,ERR_TRACEHASHEXCLUSIVE,,,false,false,false,false,--,error,,The --hashes and --trace options are exclusive.
12636,tools,ChainData,blocks,getBlocks,ERR_ATLEASTONEBLOCK,,,false,false,false,false,--,error,,You must specify at least one block.
12638,tools,ChainData,blocks,getBlocks,ERR_EMTOPONLYWITHLOG,,,false,false,false,false,--,error,,The --emitter and --topic options are only available with the --log option.
12640,tools,ChainData,blocks,getBlocks,ERR_ARTWITHOUTLOGS,,,false,false,false,false,--,error,,The --artcilate option is only available with the --logs option.
12642,tools,ChainData,blocks,getBlocks,ERR_RANGENOLOGS,,,false,false,false,false,--,error,,The --big_range option is only available with the --logs option (min 50).

13540,tools,ChainData,transactions,getTrans,transactions,,,true,false,true,true,local,positional,list<tx_id>,a space-separated list of one or more transaction identifiers
13560,tools,ChainData,transactions,getTrans,articulate,a,,false,false,true,true,header,switch,<boolean>,articulate the retrieved data if ABIs can be found
13580,tools,ChainData,transactions,getTrans,trace,t,,false,false,true,true,header,switch,<boolean>,include the transaction's traces in the results
13605,tools,ChainData,transactions,getTrans,uniq,u,,false,false,true,true,header,switch,<boolean>,display a list of uniq addresses found in the transaction
13605,tools,ChainData,transactions,getTrans,reconcile,r,,false,false,true,true,header,flag,<address>,reconcile the transaction as per the provided address
13600,tools,ChainData,transactions,getTrans,cache,o,,false,false,true,true,header,switch,<boolean>,force the results of the query into the tx cache (and the trace cache if applicable)
13620,tools,ChainData,transactions,getTrans,,,,false,false,true,true,--,description,,Retrieve one or more transactions from the chain or local cache.
13622,tools,ChainData,transactions,getTrans,n1,,,false,false,false,false,--,note,,The `transactions` list may be one or more transaction hashes&#44; blockNumber.transactionID pairs&#44; or a blockHash.transactionID pairs.
13624,tools,ChainData,transactions,getTrans,n2,,,false,false,false,false,--,note,,This tool checks for valid input syntax&#44; but does not check that the transaction requested actually exists.
13629,tools,ChainData,transactions,getTrans,n3,,,false,false,false,false,--,note,,If the queried node does not store historical state&#44; the results for most older transactions are undefined.
13630,tools,ChainData,transactions,getTrans,ERR_PROVIDEONETXID,,,false,false,false,false,--,error,,Please specify at least one transaction identifier.

13000,tools,ChainData,receipts,getReceipts,transactions,,,true,false,true,true,local,positional,list<tx_id>,a space-separated list of one or more transaction identifiers
13020,tools,ChainData,receipts,getReceipts,articulate,a,,false,false,true,true,header,switch,<boolean>,articulate the retrieved data if ABIs can be found
13060,tools,ChainData,receipts,getReceipts,,,,false,false,true,true,--,description,,Retrieve receipts for the given transaction(s).
13062,tools,ChainData,receipts,getReceipts,n1,,,false,false,false,false,--,note,,The `transactions` list may be one or more transaction hashes&#44; blockNumber.transactionID pairs&#44; or a blockHash.transactionID pairs.
13066,tools,ChainData,receipts,getReceipts,n2,,,false,false,false,false,--,note,,This tool checks for valid input syntax&#44; but does not check that the transaction requested actually exists.
13070,tools,ChainData,receipts,getReceipts,n3,,,false,false,false,false,--,note,,If the queried node does not store historical state&#44; the results for most older transactions are undefined.
13071,tools,ChainData,receipts,getReceipts,ERR_PROVIDEONETXID,,,false,false,false,false,--,error,,Please specify at least one transaction identifier.

12920,tools,ChainData,logs,getLogs,transactions,,,true,false,true,true,local,positional,list<tx_id>,a space-separated list of one or more transaction identifiers
12940,tools,ChainData,logs,getLogs,articulate,a,,false,false,true,true,header,switch,<boolean>,articulate the retrieved data if ABIs can be found
12960,tools,ChainData,logs,getLogs,,,,false,false,true,true,--,description,,Retrieve logs for the given transaction(s).
12962,tools,ChainData,logs,getLogs,n1,,,false,false,false,false,--,note,,The `transactions` list may be one or more transaction hashes&#44; blockNumber.transactionID pairs&#44; or a blockHash.transactionID pairs.
12964,tools,ChainData,logs,getLogs,n2,,,false,false,false,false,--,note,,This tool checks for valid input syntax&#44; but does not check that the transaction requested actually exists.
12966,tools,ChainData,logs,getLogs,n3,,,false,false,false,false,--,note,,If the queried node does not store historical state&#44; the results for most older transactions are undefined.
12968,tools,ChainData,logs,getLogs,n4,,,false,false,false,false,--,note,,If you specify a 32-byte hash&#44; it will be assumed to be a transaction hash&#44; if the transaction is not found&#44; it will be used as a topic.
12968,tools,ChainData,logs,getLogs,ERR_PROVIDEONETXID,,,false,false,false,false,--,error,,Please specify at least one transaction identifier.

13400,tools,ChainData,traces,getTraces,transactions,,,true,false,true,true,local,positional,list<tx_id>,a space-separated list of one or more transaction identifiers
13420,tools,ChainData,traces,getTraces,articulate,a,,false,false,true,true,header,switch,<boolean>,articulate the retrieved data if ABIs can be found
13490,tools,ChainData,traces,getTraces,filter,f,,false,false,true,true,header,flag,<string>,call the node's trace_filter routine with bang-separated filter
13420,tools,ChainData,traces,getTraces,statediff,d,,false,false,true,true,header,switch,<boolean>,export state diff traces (not implemented)
13440,tools,ChainData,traces,getTraces,count,c,,false,false,true,true,header,switch,<boolean>,show the number of traces for the transaction only (fast)
13460,tools,ChainData,traces,getTraces,skip_ddos,s,true,false,true,false,false,header,toggle,<boolean>,skip over the 2016 ddos during export ([{DEF}] by default)
13480,tools,ChainData,traces,getTraces,max,m,250,false,true,false,false,header,flag,<uint64>,if --skip_ddos is on&#44; this many traces defines what a ddos transaction is
13500,tools,ChainData,traces,getTraces,,,,false,false,true,true,--,description,,Retrieve traces for the given transaction(s).
13622,tools,ChainData,traces,getTraces,n1,,,false,false,false,false,--,note,,The `transactions` list may be one or more transaction hashes&#44; blockNumber.transactionID pairs&#44; or a blockHash.transactionID pairs.
13624,tools,ChainData,traces,getTraces,n2,,,false,false,false,false,--,note,,This tool checks for valid input syntax&#44; but does not check that the transaction requested actually exists.
13626,tools,ChainData,traces,getTraces,n3,,,false,false,false,false,--,note,,If the queried node does not store historical state&#44; the results for most older transactions are undefined.
13627,tools,ChainData,traces,getTraces,n4,,,false,false,false,false,--,note,,A bang separated filter has the following fields (at least one of which is required) and is separated with a bang (!): fromBlk&#44; toBlk&#44; fromAddr&#44; toAddr&#44; after&#44; count.
13628,tools,ChainData,traces,getTraces,n5,,,false,false,false,false,--,note,,A state diff trace describes&#44; for each modified address&#44; what changed during that trace.
13629,tools,ChainData,traces,getTraces,ERR_PROVIDEONETXID,,,false,false,false,false,--,error,,Please specify at least one transaction identifier.

13940,tools,ChainData,when,whenBlock,blocks,,,true,false,true,false,local,positional,list<string>,one or more dates&#44; block numbers&#44; hashes&#44; or special named blocks (see notes)
13960,tools,ChainData,when,whenBlock,list,l,,false,false,true,false,header,switch,<boolean>,export a list of the 'special' blocks
13962,tools,ChainData,when,whenBlock,timestamps,t,,false,false,true,true,header,switch,<boolean>,ignore other options and generate timestamps only
13963,tools,ChainData,when,whenBlock,check,c,,false,false,false,false,header,switch,<boolean>,available only with --timestamps&#44; checks the validity of the timestamp data
