num,group,tags,api_route,tool,longName,hotKey,def_val,is_required,is_customizable,is_visible,is_visible_docs,generate,option_type,data_type,description
13965,tools,ChainData,when,whenBlock,fix,f,,false,false,false,false,header,switch,<boolean>,available only with --timestamps&#44; fixes incorrect timestamps if any
13966,tools,ChainData,when,whenBlock,count,u,,false,false,false,false,header,switch,<boolean>,available only with --timestamps&#44; returns the number of timestamps in the cache
13966,tools,ChainData,when,whenBlock,no_update,n,,false,false,false,false,header,switch,<boolean>,do not update timestamps database prior to completing the task at hand
13980,tools,ChainData,when,whenBlock,,,,false,false,true,false,--,description,,Find block(s) based on date&#44; blockNum&#44; timestamp&#44; or 'special'.
13982,tools,ChainData,when,whenBlock,n1,,,false,false,false,false,--,note,,The block list may contain any combination of `number`&#44; `hash`&#44; `date`&#44; special `named` blocks.
13984,tools,ChainData,when,whenBlock,n2,,,false,false,false,false,--,note,,Dates must be formatted in JSON format: YYYY-MM-DD[THH[:MM[:SS]]].
13987,tools,ChainData,when,whenBlock,ERR_OPENINGTIMESTAMPS,,,false,false,false,false,--,error,,Could not open timestamp file.
13987,tools,ChainData,when,whenBlock,ERR_INVALIDDATE1,,,false,false,false,false,--,error,,Please supply either a JSON formatted date or a blockNumber.
13987,tools,ChainData,when,whenBlock,ERR_INVALIDDATE2,,,false,false,false,false,--,error,,Invalid date '[{ARG}]'.
13987,tools,ChainData,when,whenBlock,ERR_INVALIDDATE3,,,false,false,false,false,--,error,,The date you specified ([{ARG}]) is before the first block.
13988,tools,ChainData,when,whenBlock,ERR_ONLYTS,,,false,false,false,false,--,error,,The --check&#44; --fix&#44; and --count options are only available with the --timestamps option.

13100,tools,ChainState,state,getState,addrs,,,true,false,true,true,header,positional,list<addr>,one or more addresses (0x...) from which to retrieve balances
13120,tools,ChainState,state,getState,blocks,,,false,false,true,true,header,positional,list<blknum>,an optional list of one or more blocks at which to report balances&#44; defaults to 'latest'
13140,tools,ChainState,state,getState,parts,p,,false,false,true,true,local,flag,list<enum[none|some*|all|balance|nonce|code|storage|deployed|accttype]>,control which state to export
13160,tools,ChainState,state,getState,changes,c,,false,false,true,true,header,switch,<boolean>,only report a balance when it changes from one block to the next
13180,tools,ChainState,state,getState,no_zero,n,,false,false,true,true,header,switch,<boolean>,suppress the display of zero balance accounts
13190,tools,ChainState,state,getState,call,a,,false,false,false,true,header,flag,<string>,a bang-separated string consisting of address!4-byte!bytes
13190,tools,ChainState,state,getState,proxy_for,r,,false,false,false,true,header,flag,<address>,for the --call option only&#44; redirects calls to this implementation
13220,tools,ChainState,state,getState,,,,false,false,true,true,--,description,,Retrieve account balance(s) for one or more addresses at given block(s).
13222,tools,ChainState,state,getState,n1,,,false,false,false,false,--,note,,An `address` must start with '0x' and be forty-two characters long.
13224,tools,ChainState,state,getState,n2,,,false,false,false,false,--,note,,`blocks` may be a space-separated list of values&#44; a start-end range&#44; a `special`&#44; or any combination.
13228,tools,ChainState,state,getState,n3,,,false,false,false,false,--,note,,If the queried node does not store historical state&#44; the results are undefined.
13230,tools,ChainState,state,getState,n4,,,false,false,false,false,--,note,,`special` blocks are detailed under `chifra when --list`.
13232,tools,ChainState,state,getState,n5,,,false,false,false,false,--,note,,`balance` is the default mode. To select a single mode use `none` first&#44; followed by that mode.
13234,tools,ChainState,state,getState,n6,,,false,false,false,false,--,note,,You may specify multiple `modes` on a single line.

13260,tools,ChainState,tokens,getTokens,addrs2,,,true,false,true,true,header,positional,list<addr>,two or more addresses (0x...)&#44; the first is an ERC20 token&#44; balances for the rest are reported
13280,tools,ChainState,tokens,getTokens,blocks,,,false,false,true,true,header,positional,list<blknum>,an optional list of one or more blocks at which to report balances&#44; defaults to 'latest'
13300,tools,ChainState,tokens,getTokens,parts,p,,false,false,true,true,local,flag,list<enum[name|symbol|decimals|totalSupply|version|none|all*]>,which parts of the token information to retrieve
13320,tools,ChainState,tokens,getTokens,by_acct,b,,false,false,true,true,header,switch,<boolean>,consider each address an ERC20 token except the last&#44; whose balance is reported for each token
13340,tools,ChainState,tokens,getTokens,no_zero,n,,false,false,true,true,header,switch,<boolean>,suppress the display of zero balance accounts
13360,tools,ChainState,tokens,getTokens,,,,false,false,true,true,--,description,,Retrieve token balance(s) for one or more addresses at given block(s).
13362,tools,ChainState,tokens,getTokens,n1,,,false,false,false,false,--,note,,An `address` must start with '0x' and be forty-two characters long.
13364,tools,ChainState,tokens,getTokens,n2,,,false,false,false,false,--,note,,`blocks` may be a space-separated list of values&#44; a start-end range&#44; a `special`&#44; or any combination.
13368,tools,ChainState,tokens,getTokens,n3,,,false,false,false,false,--,note,,If the token contract(s) from which you request balances are not ERC20 compliant&#44; the results are undefined.
13370,tools,ChainState,tokens,getTokens,n4,,,false,false,false,false,--,note,,If the queried node does not store historical state&#44; the results are undefined.
13372,tools,ChainState,tokens,getTokens,n5,,,false,false,false,false,--,note,,`special` blocks are detailed under `chifra when --list`.

11111,apps,Admin,,blockScrape,action,a,,false,true,true,true,local,flag,enum[toggle|run|restart|pause|quit],command to apply to the specified scrape
11112,apps,Admin,,blockScrape,pin,p,,false,false,true,true,header,switch,<boolean>,pin chunks (and blooms) to IPFS as they are created (requires pinning service)
11113,apps,Admin,,blockScrape,publish,u,,false,false,true,true,header,switch,<boolean>,after pinning the chunk&#44; publish it to UnchainedIndex
11116,apps,Admin,,blockScrape,block_cnt,n,2000,false,true,true,true,header,flag,<uint64>,maximum number of blocks to process per pass
11117,apps,Admin,,blockScrape,block_chan_cnt,b,10,false,true,false,false,config,flag,<uint64>,number of concurrent block processing channels
11118,apps,Admin,,blockScrape,addr_chan_cnt,d,20,false,true,false,false,config,flag,<uint64>,number of concurrent address processing channels
11119,apps,Admin,,blockScrape,apps_per_chunk,,2000000,false,true,false,false,config,flag,<uint64>,the number of appearances to build into a chunk before consolidating it
11120,apps,Admin,,blockScrape,unripe_dist,,28,false,true,false,false,config,flag,<uint64>,the distance (in blocks) from the front of the chain under which (inclusive) a block is considered unripe
11121,apps,Admin,,blockScrape,snap_to_grid,,100000,false,true,false,false,config,flag,<uint64>,an override to apps_per_chunk to snap-to-grid at every modulo of this value&#44; this allows easier corrections to the index
11122,apps,Admin,,blockScrape,first_snap,,2250000,false,true,false,false,config,flag,<uint64>,the first block at which snap_to_grid is enabled
11123,apps,Admin,,blockScrape,allow_missing,,,false,true,false,false,config,flag,<boolean>,do not report errors for blockchain that contain blocks with zero addresses
11124,apps,Admin,,blockScrape,n_test_runs,,0,false,true,false,false,config,flag,<uint64>,in live testing mode&#44; the number of test runs to process before quitting
11125,apps,Admin,,blockScrape,,,,false,false,true,true,--,description,,Scan the chain and update (and optionally pin) the TrueBlocks index of appearances.

12110,apps,Admin,scrape,flame-scrape,modes,,,true,false,true,true,local,positional,list<enum[indexer|monitors|both]>,which scraper(s) to control
12113,apps,Admin,scrape,flame-scrape,action,a,,false,true,true,true,local,flag,enum[toggle|run|restart|pause|quit],command to apply to the specified scrape
12115,apps,Admin,scrape,flame-scrape,sleep,s,14,false,false,true,true,gocmd,flag,<double>,seconds to sleep between scraper passes
12117,apps,Admin,scrape,flame-scrape,pin,p,,false,false,true,true,header,switch,<boolean>,pin chunks (and blooms) to IPFS as they are created (requires pinning service)
12119,apps,Admin,scrape,flame-scrape,publish,u,,false,false,true,true,header,switch,<boolean>,after pinning the chunk&#44; publish it to UnchainedIndex
12121,apps,Admin,scrape,flame-scrape,block_cnt,n,2000,false,true,true,true,header,flag,<uint64>,maximum number of blocks to process per pass
12125,apps,Admin,scrape,flame-scrape,block_chan_cnt,b,10,false,true,false,false,config,flag,<uint64>,number of concurrent block processing channels
12127,apps,Admin,scrape,flame-scrape,addr_chan_cnt,d,20,false,true,false,false,config,flag,<uint64>,number of concurrent address processing channels
12152,apps,Admin,scrape,flame-scrape,,,,false,false,true,true,--,description,,Scan the chain and update (and optionally pin) the TrueBlocks index of appearances.
12153,apps,Admin,scrape,flame-scrape,n1,,,false,false,false,false,--,note,,if no mode is presented&#44; chifra scrape indexer --action run is assumed.
12154,apps,Admin,scrape,flame-scrape,n2,,,false,false,false,false,--,note,,the --pin and --publish options require an API to the pinning service.
12155,apps,Admin,scrape,flame-scrape,n3,,,false,false,false,false,--,note,,the --n_* related options allow you to tune the scrapers.

13111,apps,Admin,serve,flame,port,p,:8080,false,false,true,true,header,flag,<string>,specify the server's port
13112,apps,Admin,serve,flame,,,,false,false,true,true,--,description,,Serve the TrueBlocks API using the flame server.
13113,apps,Admin,serve,flame,n1,,,false,false,false,false,--,note,,To start API open terminal window and run chifra serve.
13114,apps,Admin,serve,flame,n2,,,false,false,false,false,--,note,,See the API documentation for more information.

10700,apps,Admin,status,cacheStatus,modes,,,false,false,true,true,local,positional,list<enum[index|monitors|collections|names|abis|caches|some*|all]>,the type of status info to retrieve
10720,apps,Admin,status,cacheStatus,details,d,,false,false,true,true,header,switch,<boolean>,include details about items found in monitors&#44; slurps&#44; abis&#44; or price caches
10730,apps,Admin,status,cacheStatus,types,t,,false,false,true,false,local,flag,list<enum[blocks|txs|traces|slurps|prices|all*]>,for caches mode only&#44; which type(s) of cache to report
10735,apps,Admin,status,cacheStatus,depth,p,NOPOS,false,false,false,false,header,flag,<uint64>,for cache mode only&#44; number of levels deep to report
10760,apps,Admin,status,cacheStatus,report,r,,false,false,false,true,local,deprecated,<boolean>,run the command with no options for the same result
10770,apps,Admin,status,cacheStatus,terse,e,,false,false,false,true,header,switch,<boolean>,show a terse summary report
10782,apps,Admin,status,cacheStatus,migrate,m,,false,false,false,false,local,flag,enum[test|all],either effectuate or test to see if a migration is necessary
10820,apps,Admin,status,cacheStatus,first_block,F,0,false,false,false,false,local,flag,<blknum>,first block to process (inclusive -- testing only)
10840,apps,Admin,status,cacheStatus,last_block,L,NOPOS,false,false,false,false,local,flag,<blknum>,last block to process (inclusive -- testing only)
10860,apps,Admin,status,cacheStatus,,,,false,false,true,true,--,description,,Report on the status of the TrueBlocks system.

21950,apps,Admin,chunks,chunkMan,blocks,,,false,false,true,true,header,positional,list<blknum>,an optional list of blocks to process
21954,apps,Admin,chunks,chunkMan,check,c,,false,false,true,true,header,switch,<boolean>,check the validity of the chunk or bloom
21956,apps,Admin,chunks,chunkMan,extract,e,,false,false,true,true,header,flag,enum[header|addr_table|app_table|chunks|blooms],show some or all of the contents of the chunk or bloom filters
21958,apps,Admin,chunks,chunkMan,stats,s,,false,false,true,true,header,switch,<boolean>,for the --list option only&#44; display statistics about each chunk or bloom
21960,apps,Admin,chunks,chunkMan,save,a,,false,false,true,true,header,switch,<boolean>,for the --extract option only&#44; save the entire chunk to a similarly named file as well as display
21962,apps,Admin,chunks,chunkMan,,,,false,false,true,true,--,description,,Manage and investigate chunks and bloom filters.
21964,apps,Admin,chunks,chunkMan,n1,,,false,false,false,false,--,note,,Only a single block in a given chunk needs to be supplied.

10950,apps,Admin,pins,pinMan,list,l,,false,false,true,true,local,switch,<boolean>,list the bloom and index hashes from local cache or IPFS
10952,apps,Admin,pins,pinMan,init,i,,false,false,true,true,header,switch,<boolean>,download the blooms or index chunks from IPFS
10958,apps,Admin,pins,pinMan,all,a,,false,false,true,true,header,switch,<boolean>,in addition to Bloom filters&#44; download full index chunks
10962,apps,Admin,pins,pinMan,share,S,,false,false,true,true,header,switch,<boolean>,share downloaded data by pinning it to IPFS (the IPFS daemon must be running)
10960,apps,Admin,pins,pinMan,sleep,s,.25,false,false,true,true,header,flag,<double>,throttle requests by this many seconds
10954,apps,Admin,pins,pinMan,freshen,f,,false,false,false,false,header,deprecated,<boolean>,check for new bloom or index chunks and download if available
10956,apps,Admin,pins,pinMan,remote,r,,false,false,false,false,header,deprecated,<boolean>,for --list mode only&#44; recover the manifest from IPFS via UnchainedIndex smart contract
10964,apps,Admin,pins,pinMan,init_all,n,,false,false,false,false,header,deprecated,<boolean>,use --init --all instead
10966,apps,Admin,pins,pinMan,,,,false,false,true,true,--,description,,Manage pinned index of appearances and associated blooms.
10970,apps,Admin,pins,pinMan,n1,,,false,false,false,false,--,note,,One of `--list` or `--init` is required.
10974,apps,Admin,pins,pinMan,n2,,,false,false,false,false,--,note,,Re-run `chifra init` as often as you wish. It will repair or freshen the index.
10972,apps,Admin,pins,pinMan,n3,,,false,false,false,false,--,note,,The `--share` option works only if an IPFS daemon is running.

11905,apps,Admin,init,pinMan,all,a,,false,false,true,true,header,switch,<boolean>,in addition to Bloom filters&#44; download full index chunks
11910,apps,Admin,init,pinMan,,,,false,false,true,true,--,description,,Initialize the TrueBlocks system by downloading from IPFS.
11915,apps,Admin,init,pinMan,n1,,,false,false,false,false,--,note,,`chifra init` is an alias for the `chifra pins --init` command.
11920,apps,Admin,init,pinMan,n2,,,false,false,false,false,--,note,,See `chifra pins --help` for more information.

12020,tools,Other,quotes,getQuotes,update,u,,false,false,true,true,local,switch,<boolean>,freshen price database
12040,tools,Other,quotes,getQuotes,period,p,,false,false,true,true,local,flag,enum[5|15|30|60|120*|240|1440|10080|hourly|daily|weekly],increment of display
12060,tools,Other,quotes,getQuotes,pair,a,,false,false,true,true,local,flag,<string>,which price pair to freshen or list (see Poloniex)
12060,tools,Other,quotes,getQuotes,feed,e,,false,false,true,true,header,flag,enum[poloniex*|maker|tellor],the feed for the price data
12080,tools,Other,quotes,getQuotes,,,,false,false,true,true,--,description,,Update or display Ethereum price data&#44; this tool has been deprecated.
12082,tools,Other,quotes,getQuotes,n1,,,false,false,false,false,--,note,,Due to restrictions from Poloniex&#44; this tool retrieves only 30 days of data at a time. You must repeatedly run this command until the data is up-to-date.

12001,apps,Other,explore,fireStorm,terms,,,false,false,true,true,header,positional,list<string>,one or more address&#44; name&#44; block&#44; or transaction identifier
12002,apps,Other,explore,fireStorm,local,l,,false,false,true,true,header,switch,<boolean>,open the local TrueBlocks explorer
12003,apps,Other,explore,fireStorm,google,g,,false,false,true,true,header,switch,<boolean>,search google excluding popular blockchain explorers
12002,apps,Other,explore,fireStorm,,,,false,false,true,true,--,description,,Open a local or remote explorer for one or more addresses&#44; blocks&#44; or transactions.

12120,tools,Other,slurp,ethslurp,addrs,,,true,false,true,true,header,positional,list<addr>,one or more addresses to slurp from Etherscan
12140,tools,Other,slurp,ethslurp,blocks,,,false,false,true,true,header,positional,list<blknum>,an optional range of blocks to slurp
12160,tools,Other,slurp,ethslurp,types,t,,false,false,true,true,local,flag,list<enum[ext*|int|token|nfts|miner|uncles|all]>,which types of transactions to request
12180,tools,Other,slurp,ethslurp,appearances,p,,false,false,true,true,header,switch,<boolean>,show only the blocknumer.tx_id appearances of the exported transactions
12220,tools,Other,slurp,ethslurp,,,,false,false,true,true,--,description,,Fetch data from EtherScan for any address.
12222,tools,Other,slurp,ethslurp,n1,,,false,false,false,false,--,note,,Portions of this software are Powered by Etherscan.io APIs.

11660,dev_tools,,,makeClass,files,,,true,false,true,false,local,positional,list<path>,one or more class definition files
11740,dev_tools,,,makeClass,all,a,,false,false,true,false,header,switch,<boolean>,list&#44; or run all class definitions found in the local folder
11780,dev_tools,,,makeClass,options,o,,false,false,true,false,local,switch,<boolean>,export options code (check validity in the process)
11780,dev_tools,,,makeClass,gocmds,g,,false,false,true,false,local,switch,<boolean>,export go command code
11780,dev_tools,,,makeClass,readmes,m,,false,false,true,false,local,switch,<boolean>,create readme files for each tool and app
11782,dev_tools,,,makeClass,format,f,,false,false,true,false,local,switch,<boolean>,format source code files (.cpp and .h) found in local folder and below
11784,dev_tools,,,makeClass,lint,l,,false,false,true,false,local,switch,<boolean>,lint source code files (.cpp and .h) found in local folder and below
11786,dev_tools,,,makeClass,tsx,t,,false,false,true,false,header,switch,<boolean>,create typescript routes,help text and types for the front end
11788,dev_tools,,,makeClass,dump,d,,false,false,false,false,local,switch,<boolean>,dump any classDefinition config tomls to screen and quit
11781,dev_tools,,,makeClass,openapi,A,,false,false,false,false,header,switch,<boolean>,export openapi.yaml file for API documentation
11824,dev_tools,,,makeClass,,,,false,false,true,false,--,description,,Automatically writes C++ for various purposes.
11826,dev_tools,,,makeClass,n1,,,false,false,false,false,--,note,,The `--options` flag generates `COption` code for each of the various tools.
11830,dev_tools,,,makeClass,n2,,,false,false,false,false,--,note,,More information on class definition files is found in the documentation.
11832,dev_tools,,,makeClass,ERR_CLASSDEFNOTEXIST,,,false,false,false,false,--,error,,./classDefinitions folder does not exist.
11834,dev_tools,,,makeClass,ERR_CONFIGMISSING,,,false,false,false,false,--,error,,File {0} does not exist.
11842,dev_tools,,,makeClass,ERR_NEEDONECLASS,,,false,false,false,false,--,error,,Please specify at least one className.

11880,dev_tools,,,testRunner,mode,m,,false,false,true,false,local,flag,enum[cmd*|api|both],determine which set of tests to run
11900,dev_tools,,,testRunner,filter,f,,false,false,true,false,header,flag,enum[fast*|medi|slow|all],determine how long it takes to run tests
11920,dev_tools,,,testRunner,clean,c,,false,false,true,false,header,switch,<boolean>,clean working folder before running tests
11930,dev_tools,,,testRunner,skip,s,1,false,false,false,false,header,flag,<uint64>,run only every 'skip' test (faster)
11960,dev_tools,,,testRunner,report,r,,false,false,true,false,header,switch,<boolean>,display performance report to screen
11980,dev_tools,,,testRunner,,,,false,false,true,false,--,description,,Run TrueBlocks' test cases with options.
